id,lyrics,arousal_bin,valence_bin
1,"Uhh,  alright I did it, hahah, yeah Used to treat my mattress like the ATM, yeah Bond number 9 that's my favorite scent, yeah Can't forget the kush, I'm talking OG, yeah Rest in peace to pop, he was an OG, oh yeah 285 I had that pack on me, uh I cannot forget I had that strap on me, yeah Rest in peace to my nigga Doe All we ever want to do is ball That was the easy part We playing that Weezy hard We sit in the kitchen late We tryna to make an escape Trying to make me a mil So I'ma keep me a plate I told 'em shawty can leave So I'mma keep me a rake So I'ma keep me a Wraith My jewelry look like a lake Today I'm in the Maybach And that car came with some drapes You know I look like a safe I put you back in your place I look you right in your face Sing to your bitch like I'm Drake Yeah Good drank, big knots Good drugs, I put a four on the rocks Drop top, no hot box 12 tried to pull me over, pink slips to the cops She said the molly give her thizz face Put the dick in her rib cage Whips out, Kunta Kinte Diamonds clear like Bombay Take your babies, no Harambe Play with keys like Doc Dre 3K like André And your girl, call her cum face It's Gucci! Huh  huh! Your trunk in the front Well check this out my top in the trunk You play with my money Then check this out you're poppin' the trunk Three mil in a month But I just did three years on a bunk Oh, you in a slump I'm headed to Oakland like Kevin Da Runt What is your point Square with the stamp, **** Kevin Durant Lay on on my trap Play with my cap and I'll knock off your hat I'm taking the cheese and killing the rats Gucci Mane, call me the cat with the racks I'm swervin', but I'm in back of the 'Bach I'm Persian, man I got hoes from Iraq I'm servin' I pay a bird for that He nervous, ain't got no words for that He hurt and want all of his purses back He mixing the syrup with the Percocets She perfect and she got perky breasts I just want some of that turkey neck Trapper of the year, I'm from Bouldercrest You snitch of the year cause you told the bis' Good drank, big knots Good drugs, I put a four on the rocks Drop top, no hot box 12 tried to pull me over, pink slips to the cops She said the molly give her thizz face Put the dick in her rib cage Whips out Kunta Kinte Diamonds clear like Bombay Take your babies, no Harambe Play with keys like Doc Dre 3K like Andre And your girl, call her cum face Aye, Mike Dean This shit hard as ****, bruh You a living legend, I appreciate that Aye, Guwop, I'm glad you home, cuz Quavo, you already know man You got next on these niggas double salute man True shit, 2 Chainz! Hair Weave Killer Daniel Son, the Necklace Don Chapo Jr I mean, I can go on for days",0.0,1.0
5,"{Hook} Young Savage, why you trappin' so hard? Why these niggas cappin' so hard? Why you got a 12 car garage? Why you pullin' all these rappers cards? Cause these niggas pussy and I'm hard I turn that ****ing soft into some hard I grew up in the streets without no heart I'm praying to my Glock and my card {Verse 1} I sit back and read like Cat in the Hat 21 Savage, the cat with the MAC 21 Savage not Boyz N The Hood but I pull up on you, shoot your ass in the back Stuart Little, heard these niggas some rats Pockets full of cheese, bitch I got racks I'm a real street nigga bitch I am not one of these niggas bangin' on wax Pussy niggas love sneak dissing 'til I pull up on 'em, slap 'em out with the fire Wet your mama's house, wet your grandma's house, keep shootin' until somebody die So many shots the neighbor looked at the calendar, thought it was Fourth of July You was with your friends playing Nintendo, I was playin' 'round with that fire Seventh grade I got caught with a pistol, sent me to Pantherville Eighth grade started playin' football, then I was like **** the field Ninth grade I was knocking niggas out, nigga like Holyfield Fast forward nigga, 2016 and I'm screaming **** a deal Bad bitch with me, she so thick, I don't even need a pill I listen to your raps, thought you was hard You ain't even street for real Niggas love sneak dissing on twitter They don't want beef for real And all these niggas play like they tough 'till a nigga get killed 'till a nigga get spilled, 'til your blood get spilled I'ma at your favorite rapper, shoot him like I'm John Dill' ""I been with you since day one, Savage I ain't even hating"" So what's up with all that instagram shit? ""Savage I was just playin'"" Y'all pussy niggas fakin', bitch I hang around them Haitians Pull up on you, tie your kids up Pistol whip you while your bitch naked ""Come on man, Savage you know I always play your mixtape"" Yeah nigga **** all that, ask your bitch how my dick tastes {Hook} Young Savage, why you trappin' so hard? Why these niggas cappin' so hard? Why you got a 12 car garage? Why you pullin' all these rappers cards? Cause these niggas pussy and I'm hard I turn that ****ing soft into some hard I grew up in the streets without no heart I'm praying to my Glock and my card {Verse 2} So much dope that it broke the scale They say crack kills, nigga my crack sells My brother in the kitchen and he rappin' a bale Louis V my bag and Louis V on my belt Chain swangin', diamonds blangin', hold up Pistol swangin', gang bangin', hold up Niggas actin' like groupies, they don't know us Little do they know their bitches ****in' on the tour bus {Hook} Young Savage, why you trappin' so hard? Why these niggas cappin' so hard? Why you got a 12 car garage? Why you pullin' all these rappers cards? Cause these niggas pussy and I'm hard I turn that ****ing soft into some hard I grew up in the streets without no heart I grew up in the streets without no heart {Outro} So much dope that it broke the scale They say crack kills, nigga my crack sells My brother in the kitchen and he rappin' a bale Louis V my bag and Louis V on my belt",0.0,0.0
6,"Yeah, Yeah, Yeah I pull up roll the window down and I pull up roll the window down and I pull up roll the window down and I just bought a pistol it got 30 rounds in it Pull up at yo momma house and put some rounds in it Wet a ***** block and watch them *****s drown in it Hunnid round drum gun a ***** down with it I'm on that Slaughter Gang *****t, Murder Gang *****t Slaughter Gang *****t, Murder Gang *****t I'm on that Slaughter Gang *****t, Murder Gang *****t Slaughter Gang *****t, Murder Gang *****t I'm on that Slaughter Gang *****t Take a ***** ***** ***** yous a ***** cuz I ran off with ya *****t I'm a real right blood and these *****s counterfeit You don't pull up on the Ave ***** boy you get dipped I bought a brand new drop and then I poured me up some drop Young Savage real street ***** ya'll ain't on no block ***** keep your legs closed cuz all I want is top I pull up and pew pew pew y'all gone call the cops 21 I just bought a pistol it got 30 rounds in it Pull up at yo momma house and put some rounds in it Wet a ***** block and watch them *****s drown in it Hunnid round drum gun a ***** down with it I'm on that Slaughter Gang *****t, Murder Gang *****t Slaughter Gang *****t, Murder Gang *****t I'm on that Slaughter Gang *****t, Murder Gang *****t Slaughter Gang *****t, Murder Gang *****t Two guns up I don't give a ***** I'm a big dog lil' ***** you a pup Pull up on ya spot walk up on it shoot it up Yo ***** she on the molly yeah I got her booted up You said you was trappin' but I heard thats a lie Baking soda cold water cut the stove on scrape the side You can keep the skinny ***** cuz I like a fat ass and thighs ***** I'm young savage yo baby daddy know not to try I just bought a pistol it got 30 rounds in it Pull up at yo momma house and put some rounds in it Wet a ***** block and watch them *****s drown in it Hunnid round drum gun a ***** down with it I'm on that Slaughter Gang *****t, Murder Gang *****t Slaughter Gang *****t, Murder Gang *****t I'm on that Slaughter Gang *****t, Murder Gang *****t Slaughter Gang *****t, Murder Gang *****t Slaughter Gang *****t, Murder Gang *****t Slaughter Gang *****t, Murder Gang *****t Slaughter Gang *****t, Murder Gang *****t",1.0,0.0
8,"PRBLMS Lyrics Yeah, yeah Yeah, yeah Yeah, yeah Alright And she said... ""You a goddamn lie"" I ain't mean to say that shit, girl, I was goddamn high So we left the crib now we in the goddamn ride She lookin' goddamn fine I wanted a bitch who was down to Earth But she want the goddamn sky, uh List of my problems Got this one on my line that won't stop fucking callin' It's crazy I made her that way Every time I see her out, I see the hate in her face Like why you do that? Tell her you love her when next week you just want your space Why you do, why you do that? Tell her you want her but next week you do your own thing Why you do, why you do that? I can't explain it but just know it working for me She text me “I hate you, I hate you, I hate you, I hate you” But how the fuck can you hate me? When I ain't did shit, but be the real thang She know I'm the real, that'll never change I never been the one to try to explain While you catch them feels I'ma sip on this drank, it's easing my brain I got real shit to stress about, girl, I ain't worried 'bout shit Remember that I tried to build ya, now I ain't worried 'bout shit I got real shit to stress about, girl, I ain't worried 'bout shit Remember that I tried to build ya, now I ain't worried 'bout shit So I found me a new thang, I'm not as lost as you think Got plenty queens in my hometown, all they need is drank and that dank So I found me a new thang, I'm not as lost as you think Got plenty queens in my hometown, all they need is drank and that dank Now I'm like It's a goddamn shame We done crashed, we done burned But baby you the goddamn blame See I wanted love but you wanted goddamn fame Every goddamn thang I wanted a bitch who was on the move But you want to goddamn lay Uh, list of my problems Got this one in my bed and she just wants to sleep Fucking up all of the sheets She only wake up to eat Do this shit every week Like, why you do that? Crying you want to be great, but sleepin' until the next day Why you do that? Don't got that much in the bank, we go out she order the steak Why you do, why you do that? She can't explain it but just know it working for her She claiming she down on her luck but really she don't give a fuck And I cannot make this shit up And I ain't did shit but be the real thang She know I'm the real, that'll never change I won't be the one to try to explain While you catch them feels, I'ma sip on this drank, it's easing the pain You might also like I got real shit to stress about, girl, I ain't worried 'bout shit Remember that I tried to build ya, now I ain't worried 'bout shit I got real shit to stress about, girl, I ain't worried 'bout shit Remember that I tried to build ya, now I ain't worried 'bout shit So I found me a new thang, I'm not as lost as you think Got plenty queens in my hometown, all they need is drank and that dank So I found me a new thang, I'm not as lost as you think Got plenty queens in my hometown, all they need is drank and that dank153Embed",0.0,0.0
10,"I'm drownin' I'm drownin' I'm drownin' I'm drownin' Wrist so icy, wonder why she like me, bitch I'm drownin' In water, I just bought a Cuban, dipped it in a fountain Every where that I go it's a light show, I'm surrounded Bust down, bust down, bust down, bust down, bust down Bitch I'm drownin' I just bought a Cuban ring and dipped it in a fountain Chain so heavy I feel like I'm holdin' up a mountain Everywhere that I go it's a light show, I'm surrounded Bust down, bust down, bust down, bust down, bust down Bitch I'm drownin' I'm with all my niggas, I don't go nowhere without 'em If they don't let us in they might throw shots at the bouncer Actavis medicine, got it straight from out the doctor's I'm with RJ but I call him Wayne 'cause he's a shotta Pick up the ladder, put it in the gun, make the 9 stretch Niggas with attitude, but we come straight out of Highbridge I'm gon' make her panties wet when she see the way I flex I'm gon' win a Grammy, move my family out the projects We went from chillin' in the projects to makin' projects We was tryna get to the top, and they tried to stop us I talk for myself, bitch I don't need no ****ing voucher She looked at my wrist and she looked at a hundred thousand Wrist so icy, wonder why she like me, bitch I'm drownin' In water, I just bought a Cuban, dipped it in a fountain Every where that I go it's a light show, I'm surrounded Bust down, bust down, bust down, bust down, bust down Bitch, I'm drownin' I just bought a Cuban ring and dipped it in a fountain Chain so heavy I feel like I'm holdin' up a mountain Everywhere that I go it's a light show, I'm surrounded Bust down, bust down, bust down, bust down, bust down Bitch, I'm drownin' Just bought a brand new chain from Avianne Nigga with attitude but I ain't from Compton Lil Kodak bitch I'm Polo'd down like Carlton Sniper Gang I put a nigga on a carton I'm the shit I'm fartin', I don't know how to potty Pull up in a 'Rari, I'm in the Yo like Gotti A Boogie, I'm goin Scottie, nigga drop my deposit I ain't Jamaican, bitch I'm Haitian, but I got them shottas Harley Davidson every day, I'm ridin' with the chopper They hatin', I know they don't wanna see a nigga prosper I ain't doing trims, I'm in the cut like I'm a barber She call me daddy, but I ain't her mother****ing father Wrist so icy, wonder why she like me, bitch I'm drownin' In water, I just bought a Cuban, dipped it in a fountain Every where that I go it's a light show, I'm surrounded Bust down, bust down, bust down, bust down, bust down Bitch I'm drownin' I just bought a Cuban ring and dipped it in a fountain Chain so heavy I feel like I'm holdin' up a mountain Everywhere that I go it's a light show, I'm surrounded Bust down, bust down, bust down, bust down, bust down Bitch, I'm drownin' Bitch, I'm drownin' Bitch, I'm drownin' I'm drownin' Drownin' I'm drownin'",0.0,0.0
