id,lyrics,arousal_bin,valence_bin
238,"Baby I like your style Grips on your waist Front way, back way You know that I don't play Streets not safe But I never run away Even when I'm away OT, OT, there's never much love when we go OT I pray to make it back in one piece I pray, I pray That's why I need a one dance Got a Hennessy in my hand One more time 'fore I go Higher powers taking a hold on me I need a one dance Got a Hennessy in my hand One more time 'fore I go Higher powers taking a hold on me Baby I like your style Strength and guidance All that I'm wishing for my friends Nobody makes it from my ends I had to bust up the silence You know you gotta stick by me Soon as you see the text, reply me I don't wanna spend time fighting We've got no time That's why I need a one dance Got a Hennessy in my hand One more time 'fore I go Higher powers taking a hold on me I need a one dance Got a Hennessy in my hand One more time 'fore I go Higher powers taking a hold on me Got a pretty girl and she love me long time Wine it, wine it, very long time Oh yeah, very long time Back up, back up, back up and wine it Back up, back up and wine it Back up, back up, back up and wine it Oh yeah, very long time Back, up, back up and wine it, girl I need to know where do you wanna go Cause if you're down, I'll take it slow Make you lose control Where, where, where Where, where, where, where Oh yeah, very long time Where, where, where Back, up, back up and wine it, girl Where, where, where, where Cause if you're down Back up, back up and Cause if you're down Back up, back up and Cause if you're down Back up, back up and I need a one dance Got a Hennessy in my hand One more time 'fore I go Higher powers taking a hold on me I need a one dance Got a Hennessy in my hand One more time 'fore I go Higher powers taking a hold on me",1.0,1.0
239,"Yeah Nigga, what you thought? Strike, strike, strike Jeffery Feelin' rough, rough Baby, I'm needin' somethin', somethin' I won't beat it up with somethin' somethin' You're a diamond out the rough or somethin', somethin' You need to give it up to someone You need to give love to someone You need to, **** what you need You need to give it up to someone Before you end up like Woah, woah, woah, woah, like Woah, woah, woah Woah, woah, woah Woah, woah, woah Woah, woah, woah, woah, yeah, yeah I want you to myself But I know you just left someone else I know you did He did a number on you That must be why you move so icy Icy like ten-seventeen I see like there's nobody who'd ever need Better not give that all to anyone but me Patient as could be but I still need some satisfaction A little less talk and a little more action I need you out in Jamaica, relaxin' Thought I had everything somehow Feelin' rough, rough Baby, I'm needin' somethin', somethin' I won't beat it up with somethin' somethin' You're a diamond out the rough or somethin', somethin' You need to give it up to someone You need to give love to someone You need to, **** what you need You need to give it up to someone Before you end up like Woah, woah, woah, woah, like Woah, woah, woah Woah, woah, woah Woah, woah, woah Woah, woah, woah, woah, yeah, yeah I wanna see you do more in this life if we takin' it there I want to see you do 911, **** a Panamera See you when I see the real thing getting realer and realer Yeah, yeah, yeah But you icy like ten-seventeen Icy like there's nobody you'll ever need Better not give that up I'm here patient as can be, man I still need some satisfaction A little less talk and a little more action I need you out in Jamaica, relaxin' Thought I had everything somehow Feelin' rough, rough Baby, I'm needin' somethin', somethin' I won't beat it up with somethin' somethin' You're a diamond out the rough or somethin', somethin' You need to give it up to someone You need to give love to someone You need to, **** what you need You need to give it up to someone Before you end up like Woah, woah, woah, woah, like Woah, woah, woah Woah, woah, woah Woah, woah, woah Woah, woah, woah, woah, yeah, yeah Yeah Nigga, what you thought? Strike, strike, strike Jeffery",1.0,1.0
241,"9 Lyrics Yeah, for the dogs dem, you know Man when shit gets like this, man the whole city Shit's crazy right now, and shit ain't gonna stop Know shit gonna get a lot more worse before it get any better Look, mama hit my phone and said rap's no good Better than her telling me the check's no good Now they wanna act like I do no good Funny 'cause I really did more than I should I made a decision last night that I would die for it Just to show the city what it takes to be alive for it Can't get me on the line so they hang me out to dry for it You know 40 wants peace but I'm down to cut ties for it And I can't sleep these days unless I take one If they don't have a story these days, they'll make one Life is always on, man, I never get a break from it Doesn't matter where I go, I can never get away from it They give me loyalty and I don't gotta pay for it Same way, breads gotta break for it Keeping people fed is my only peace of mind now And I turn the six upside down, it's a nine now I made a decision last night that I would die for it All these hand outs, man it's getting outta hand I'ma start telling niggas ""Get it how you can"" I got it right now so I'm everybody's friend If I ever lose I bet we never speak again I made a decision last night, I'd die for it Just to show the city what it takes to be alive for it First place, first place, man we can't be tied for it I only drove it five times, paid 1.5 for it Keychain go jang-a-lang, I wanna do major things MJ in every way, I just don't fade away Six upside down, it's a nine now Like Mannie, like Stunna, man, shit is big time now And I made a decision last night that I would die for it You might also like … And then when I saw the news Make me feel afraid of how I’d been to you Trust me when I say I thought it all through Trust me when I say that shit is old moves God made himself a way from me to you Tried to kill me but they still want the Views Tried to kill me but they still want the Views Tried to kill me but I am very much alive on the six side Yeah, I said I am very much alive on the six side I said I am—73Embed",1.0,1.0
242,"Unruly, Unruly, maddas Who keeps bringing more, I've had too many This Virginia done me off already I'm blem for real, I might just say how I feel I'm blem for real, I might just say how I feel Don't switch on me, I got big plans We need to fall up to the islands And get you gold, no spray tans I need you to stop running back to your ex he's a wasteman I wanna know how come we can never slash and stay friends I'm blem for real, I might just say how I feel I'm blem for real, I might just say how I feel Cause I know what I like I know how I wanna live my life I don't need no advice You're not here and we both know why, so Move from me when your extra Move from me with the passa I'm building up a house where they raised me You move with me I'll go crazy Don't switch up on me, I got big plans We need to fall up to the islands And get you gold, no spray tans I need you to stop running back to your ex he's a wasteman I wanna know how come we can never slash and stay friends I'm blem for real, I might just say how I feel I'm blem for real, I might just say how I feel I know we can't keep it together forever Cause you’re crazy sometimes And I only see you sometimes Move from me when your extra Move from me with the passa I'm building up a house where they raised me You move with me I'll go — look Just don't switch up on me, I got big plans We need to fall up to the islands And get you gold, no spray tans I need you to stop running back to your ex he's a wasteman I wanna know how come we can never slash and stay friends I'm blem for real, I might just say how I feel I'm blem for real, I might just say how I feel Together forever Good morning, good afternoon, goodnight I'm here to talk about More Life One second",1.0,1.0
251,"I should be downtown, whipping on the way to you You got something that belongs to me Your body language says it all Despite the things you said to me Who is it that's got you all gassed up? Changing your opinion on me I was only gone for the last few months But you don't have the time to wait on me I tried with you There's more to life than sleeping in And getting high with you I had to let go of us to show myself what I could do And that just didn't sit right with you And now you're trying to make me feel a way, on purpose Now you're throwing it back in my face, on purpose Now you're talking down on my name, on purpose And you don't feel no way, you think I deserve it Feel a way, feel a way, young nigga feel a way I've stopped listening to things you say Cause you don't mean it anyway, yeah Feel a way, feel a way, young nigga feel a way Maybe we should have just did things my way Instead of the other way I tried with you There's more than life than sleeping in And getting high with you I had to let go of us to show myself what I could do And that just didn't sit right with you And now you're trying to make me feel a way, on purpose Now you're throwing it back in my face, on purpose Now you're talking down on my name, on purpose And you don't feel no way, you think I deserve it Yeah, yeah, yeah Yeah, yeah, yeah Feel a way, feel a way, young nigga feel a way I've stopped listening to things you say Feel a way, feel a way, young nigga feel a way I've stopped listening to things you say",0.0,0.0
257,"Hermes link, ice blue mink Tat on my rib like I do not know what permanent is They want me gone, wait for the kicker Bury me now and I only get bigger, that's word to my nigga Yeah, October Firm in the cut Stay at the top like I'm stuck That's just how I'm giving it up She wanna get married tonight But I can't take a knee 'cause I'm wearing all white Me and my broski are twins but we don't look alike I don't take naps Me and the money are way too attached to go and do that Muscle relax, that and a spliff Put me right on my back, I gotta unpack Virginia Black, I could go make enough money off that And not even rap—what's that? Facts? Contract max, I gotta bring that shit back Hermes link, ice blue mink Tat on my rib like I do not know what permanent is They want me gone, out of the picture Bury me now and I only get bigger, that's word to my, word to my I'm so hot yeah, I’m so right now Who's not gang bitch? Let me find out Keep hearing clicks when I'm talkin' on the iPhone Feds in the city hate to see us on a high note I switch flow like I switch time zone Can't get Nobu but you can get Milestone I gotta do mansion, 'cause I outgrew condo Got a new Maybach, she wan' **** on the drive home Yeah, met her once and I got through I'm never washed but I'm not new I know I said top five, but I'm top two And I'm not two and I got one Thought you had one, but it's not one, nigga nah Hermes link, ice blue mink Tat on my rib like I do not know what permanent is They want me gone, wait for the kicker Bury me now and I only get bigger, that's word to my niggas",0.0,0.0
260,"These things'll fall down but you'll pick 'em up You're still here to touch the ground Don't worry, I swear I know you're trying to help me Tryna stay light on my toes Just ran a light in a Rolls Told me I'm lookin' exhausted You hit it right on the nose I'm tired of all of these niggas I'm tired of all of these hoes Worried 'bout taking my lane And ain't even got on my road They turn they back and they leave you They gon' be back when they need you I practice good over evil Flippin' the script like a read-through Yeah, all of my brothers, we equal I play my part too like a sequel You tell your niggas you got 'em on anything Question is: do they believe you? 'Specially when you never come through So much hate inside your heart We don't even know what we done to you We just know shit getting run through Never chase it, let it come to you You out here tellin' everybody everything You niggas move like the one-two, yeah These things'll fall down but you'll pick 'em up You're still here to touch the ground Don't worry, I swear I know you're trying to help me I know you're trying to help me I know you're trying to help me I know, I know And more chune for your headtop, so watch how you speak on my name, you know?",0.0,0.0
263,"It's a little chilly out there How you can stand there is beyond me All of my ""let's just be friends"" are friends I don't have anymore How do you not check on me when things go wrong Guess I should've tried to keep my family closer Much closer All of my ""let's just be friends"" are friends I don't have anymore Guess that's what they say you need family for Cause I can't depend on you anymore Always saw you for what you could've been Ever since you met me Like when Chrysler made that one car that looked just like the Bentley I always saw you for what you could've been And even when it's business with you it's personal again I knew you before you made ends meet now we're meeting our ends And it's all because you chose a side You're supposed to put your pride aside and ride for me Guess it wasn't time And of course you went and chose a side that wasn't mine You're so predictable I hate people like you Kennedy Road taught me not to trust people like you How you supposed to figure what I'm going through You can't even figure out what's going on with you You judge 'fore you met me yeah it figures I make all the player's anthems for the real niggas With my dad out in Tennessee is where I belong Out here in L.A. I don't know what's going on I don't know what's going on And it's all because you chose a side You're supposed to put your pride aside and ride for me Guess it wasn't time And of course you went and chose a side that wasn't mine You sit and you pray hoping that the stars align My luck is a sure thing cause I'm living right When I needed you, you couldn't give me any advice But you always had something to say every other time Everybody that I met on the way tries to get in the way I'm fooding and serving them all like I'm working for minimum wage Someone up there must just love testing my patience Someone up there must be in need of some entertainment Forgiveness for your ways If I ever loved ya, I'll always love ya that's how I was raised Same way I'm right here still feeling the way Same way I'm realizing on a day to day All of my ""let's just be friends"" are friends I don't have anymore How do you not check on me when things go wrong Guess I should've tried to keep my family closer Much closer All of my ""let's just be friends"" are friends I don't have anymore Guess that's what they say you need family for Cause I can't depend on you anymore Much closer Anytime people want to start problems It's like “for real, are you dumb?” You know who mans are I'm not afraid no gyal heart man And I'm not afraid of no cyattie And I'm not afraid of no waste yute neither So anybody who want it can get it Say fe",0.0,0.0
267,"Ever hear some slow tracks You know what I'm sayin', with like Some pimpin' to it, or something That you can relax, pop a top to, or something Big cuppa Ac', I'm drowsy I'm still posted up where you first found me Did I just read that you just got engaged on me? I heard from your friend, you couldn't even tell me Or better yet, wait on me Nah, sha-nah-nah nah-nah-nah, sha-nah-nah nah-nah-nah Can't just leave it off that way Sha-nah-nah nah-nah-nah, sha-nah-nah-nah Can't just leave it off that way, nah At least do I get an invitation or something A statement or something Ask about that, you would say it was nothing But here's another nothin' that you made into something Can't just leave it off that way",0.0,0.0
273,"Yeah, I get it I get it Yeah Why would I say all these things to have you feelin' a way? Why would I tell you I'm 30 away if I'm not on the way? Why do I settle for women that force me to pick up the pieces? Why do I want an independent woman to feel like she needs me? I lost my way I'm searchin' for these words to say to you Please give me time Cause I'm searchin' for these words to say to you Oh please give me time Cause I'm searchin' for these words to say to you right now Redemption's on your mind when you think about me Yeah Redemption's on your mind when you think about me Yeah Run your mouth, I'd rather listen to someone else I gave your nickname to someone else I know you're seein' someone that loves you And I don't want you to see no one else I don't want you here with someone else I don't wanna do this with no one else I used to know you back when you was young Your brother brought me through, you saw me That made me think of you so differently I miss the feeling of you missing me But you say you're over and done with me Aw yeah, yeah, yeah Aw yeah, yeah, yeah Now redemption's on your mind when you think about me Aw yeah, yeah, yeah Redemption's on your mind when you think about me Aw yeah, yeah, yeah Redemption's on your mind when you think about me Aw please give me time Cause I'm searchin' for these words to say to you right now Say to you But 80 percent of it was the truth, yeah Say to you A Mercedes coupe that you're still drivin' with just me and you Girl, really gon' spend the winter with this other nigga? Act like he's really the one to get through it with you Took up with Jessica, Kim, you know that I'm bound to see you And they both say that you're over and done with me Aw yeah, yeah, yeah Aw yeah, yeah, yeah They say redemption's on your mind when you think about me Yeah, aww yeah, yeah, yeah Redemption's on your mind when you think about me Aw yeah, yeah, yeah Redemption's on your mind when you Aw please give me time Cause I'm searchin' for these words to say to you right now Damn, I'm not unrealistic with none of my women I tell them if they ain't with it then let's just forget it Relationships slowin' me down, they slow down the vision Guess I'm not in a position to deal with commitment Certain people need to tell me they're proud of me That mean a lot to me Not havin' closure, it take a lot out of me This year for Christmas I just want apologies Sydney gave up on me when I went missin' Syd had a baby and treated me different Erica sued me and opened a business Wonder if they was here, shit could have been different Wonder what they'd do put in my position I wonder, when my shit drop, do they listen? Wonder if they're second guessin' their decisions I hate the number 2, that shit is unforgiven Tryna satisfy everybody It's like they can't get enough Until enough is enough And that is too much You tip the scale when I weigh my options West Palm girls are spoiled rotten Tiffany on you, you know you poppin' I'll kill somebody if they give you problems Master bedroom's where we get it poppin' Just ignore all the skeletons in my closet I'm a walkin' come-up, I'm a bank deposit Sell my secrets and get top dollar Sell my secrets for a Range Rover Opportunity and temptation They would sell my secrets for a tropical vacation Sell my secrets back to me if I was payin' Who's gonna save me when I need savin'? Since take care, I've been caretakin' At second chances, that ain't how you livin' Redemption on your mind, I'll never be forgiven Yeah I know",0.0,0.0
280,"Your heart is hard to carry after dark You're to blame for what we could have been 'Cause look at what we are Your friends are scared to tell you you're in too far Funny that's it's always been all about you from the start I met someone new last night and we kicked it And I'm going back there tonight And you know what's on my mind, this time Going back there tonight And you know what's on my mind If you had my love And I gave you all my trust Would you comfort me? And if somehow you knew That your love would be untrue Would you lie to me? If you had my love And I gave you all my trust Would you comfort me? And if somehow you knew That your love would be untrue Would you lie to me? Out of body That's just how I feel when I'm around you shawty Last night we didn't say it, but girl we both thought it Why second guess? I should have stayed You say the word, I'm on the way This shit feels like teenage fever I'm not scared of it, she ain't either Why second guess? I should have stayed 'Cause you know what's on my mind tonight If you had my love And I gave you all my trust Would you comfort me? And if somehow you knew That your love would be untrue Would you lie to me? If you had my love And I gave you all my trust Would you comfort me? And if somehow you knew That your love would be untrue Would you lie to me? Yeah, slightly took a left turn there but Very much 6AM Slightly been awake for 24 hours so please forgive me More ideas and stuff coming Yeah, yeah, fam I'm waffling, but man is tired, fam, Jesus Christ",0.0,1.0
284,"Intro: The Winans Question is will I ever leave you? The answer is no, no, no, no, no, no Question is will I ever leave you? The answer is no, no, no, no, no, no Verse 1 Yeah, you feel the pressure, man, I know the pressure And my wifey is a spice like I’m David Beckham A lot of pent up aggression coming out of my section OVO on me while y’all niggas was playing dress-up And I know who gon’ take the fall with me They right here on call with me, they all with me You could throw curve balls but I got the glove fitted They been saying it’s love, but it isn’t love, is it? Toast to the days when they wasn’t out to get me I worked at JD’s connections whenever Jason let me , I was buying fitteds everyday Kenny's caravan and trying not to catch a stray I dropped out right before I graduate Six credits left, my mama had a saddest day “It’s only up from here, I promise, you just gotta wait” And she took my word for it, that’s all I had to say Lately I just feel so out of character The paranoia can start to turn into arrogance Thoughts too deep to go work ’em out with a therapist I get a blank page when I try to draw a comparison I’m getting straight to the point with it Need y’all to know that I never needed none of y’all niggas **** being all buddy buddy with the opposition It’s like a front of the plane, nigga, it’s all business But I haven’t flown with y’all boys in a minute Verse 2 Look, they’d rather run up on me than towards them goals My niggas still hit the club when it’s 20 below Who you think running this show? You saw it in me at 20 years old The lingo start to sound like we talking in code I got a pure soul, I don’t do the hate You don’t worry ’bout fitting in when you custom made Me and Niko used to plot on how to make a change Now me and Kobe doing shots the night before the game Still drop 40 with liquor in my system Numbers going unlisted just to create some distance I might see you on and off but I’ll never switch ya Niggas quick to double cross like both of us Christian Lamborghini got me feeling like I’m Christian Bale And I never bare my morals for the ticket sales Tipping scales, bars heavy like triple XL I never tag no one in, I’d rather get you myself Running through the 6, storming through the contracts I’m possessed, you can see it under the contacts They think I had the silver spoon but they’ll get it soon I still got something left to prove since you left me room Paint a plan for the family debt, we in the minus And like it’s going in a trunk, I put it all behind us Where you tryna go? I got it, I’ll take us wherever I’m a staple in the game, all my papers together And my life is on display like Truman They wanna pre the movements, gotta start to make 'em sooner My exes made some of my favorite music I dated women from my favorite movies Karma's such a thing of beauty I'd share more of my story but you wouldn't believe it It's far fetched like I threw that shit a hundred meters I keep it 100 like I'm running a fever I might take a breather but I won't ever leave you If I was you, I wouldn't like me either",0.0,0.0
