id,lyrics,arousal_bin,valence_bin
415,"作曲 : Rena Enea Lovelis/Nia Lovelis/Miranda Miller/Casey Moreta/Julian Bunetta/Illsey Juber/John Ryan/Jacob Kasher/Henry Walter 作词 : Rena Enea Lovelis/Nia Lovelis/Miranda Miller/Casey Moreta/Julian Bunetta/Illsey Juber/John Ryan/Jacob Kasher/Henry Walter I haven't seen my ex since we broke up Probably 'cause he didn't want to grow up ,Now I'm out and wearing something low-cut 'bout to get attention from a grown up ,'cause you hold me like a woman In a way I've never felt before And it makes me wanna hold on ,And it makes me wanna be all yours Guys my age don't know how to treat me Don't know how to treat me Don't know how to treat me Guys my age don't know how to touch me Don't know how to love me good Guys my age don't know how to keep me Don't know how to keep me Don't know how to keep me Guys my age don't know how to touch me Don't know how to love me good All he ever wanted was to go down What we supposed to do with all his friends around, yeah Smoking weed, he'd never wanna leave the house Got an empty cushion on that sofa now Told him, ""Good luck with the next one."" Maybe she'll be just as immature Gotta thank him, he's the reason That I know now what I'm looking for Guys my age don't know how to treat me Don't know how to treat me Don't know how to treat me Guys my age don't know how to touch me Don't know how to love me good Guys my age don't know how to keep me Don't know how to keep me ,Don't know how to keep me Guys my age don't know how to touch me Don't know how to love me good So I'm never going back No, I'm never going back Guys my age don't know how to treat me Don't know how to please me Don't know how to read me Guys my age don't know how to touch me Don't know how to love me good Guys my age don't know how to tease me Don't know how to leave me Don't know how to need me Guys my age don't know how to touch me Don't know how to love me good So I'm never going back Don't know, don't know, don't know No, I'm never going back Don't know how to touch me Don't know how to love me good So I'm never going back No, I'm never going back",0.0,1.0
419,"Serenity of Demise LyricsSERENITY OF DEMISE -VERSE 1- swell with in this gut-wrenching But no one screams in this tormenting violence preys love their because of ? But no one has the strenght to obey their guidance if lambs and can make an No one shall speak about our fateful defiance -CHORUS 1- only to fall Stand up to crawl Plead only to At the threshold of malediction Dispraise the wicked benediction Indulging in sinner's flagellation Christ has a brand new crucifixion Serenity of Demise -VERSE 2- Faithful of ungrateful You are all scared to pull your own strings Grateful of ungrateful Like birds can’t even use their own wings -CHORUS 2- only to fall Stand up to crawl Plead only to Lustful shape of our affliction A joy to their pure addiction It's too late for a valediction Pain has a brand new definition Serenity of Demise -BREAKDOWN pt.1- Are you washed in the blood of the lamb? In the soul-corrupting blood of the lamb? (An offer the atonement of your sins A chance a higher place in heaven Thy body slain, sweet Jesus, thine And bathed in its own blood While all exposed to wrath divine) -BREAKDOWN pt.2- Beware the christ Beware the god Beware the truth Beware the saint Beware the soul Beware the lamb Beware the saint Beware the truth You might also like-OUTRO- They want their dignity back But now, it's too much to ask Serenity of demise is the only thing that they can hear inside these howls It shall be erased It shall be erased So it shall be forgotten It shall be erased It shall be erased So it shall be forgotten It shall be erased It shall be erased If war can be holy, anything goes It shall be erased If war can be holy, anything goesEmbed",0.0,0.0
420,"作曲 : Far East Movement/The Stereotypes 作词 : Far East Movement/The Stereotypes Mo bounce, bounce, bounce, bounce Bounce, bounce, bounce Bounce in the mother****in' house Mo bounce in the mother****in' house Bounce, b-bounce, bounce, mo bounce Mo bounce, bounce, bounce Bounce in the mother****in' house Mo bounce in the mother****in' house Bounce, bounce, bounce, bounce Bounce, bounce, bounce Bounce in the mother****in' house Mo bounce in the mother****in' house Bounce, bounce, bounce, bounce Bounce, bounce, bounce Bounce in the mother****in' house Bounce, mo bounce in the mother****in' house Bounce like a mother****in' '64, sick flow Slick talk, spittin' that Crisco Drop that shit, like a cholo at the dub show Can you hit the switch and pick it up and let the world know? Homie if you're broke, oh, no you don't deserve hoes All these fake boulders only gettin' on my nerves though I just cracked a 40, now I'm sippin' out the straw slow Little bit of ratchet, little boujee, you should all know Everybody got opinions, yeah, like assholes You ain't gotta worry 'bout those, 'cause they assholes We just came to party, party, party, what you came for? M-make the neighborhood bounce to this When that shit goes down, the block get loud In your backyard bumpin' while we're blazin' out Make it bounce in the mother****in' house Mo bounce in the mother****in' house When that shit goes down, the block get loud In your backyard bumpin' while we're blazin' out Make it bounce in the mother****in' house Mo bounce in the mother****in' house Bounce, bounce, bounce, bounce Bounce, bounce, bounce Bounce, bounce, bounce, bounce Bounce, bounce, bounce Bounce, b-bounce, bounce, b-bounce Bounce, b-bounce, bounce B-bounce, bounce, b-bounce Bounce Bounce that ass, bounce that ass, yeah bounce it Puff the lah or get high off the contact Call the law, we gon' make sure we come back Fallin' off, we ain't ever been about that Hundred spokes spinnin' on a chrome rim I got a feelin' that tonight we gon' be goin' in I'm with a few bad bitches and some grown men With the ice so cold, I feel like I'm Snowden I feel like I'm rollin', but the whole place geeked up Gettin' hot in here, down to my wife beater But you ain't gotta worry, we ain't dangerous We came up M-make the neighborhood bounce to this When that shit goes down, the block get loud In your backyard bumpin' while we're blazin' out Make it bounce in the mother****in' house Mo bounce in the mother****in' house When that shit goes down, the block get loud In your backyard bumpin' while we're blazin' out Make it bounce in the mother****in' house Mo bounce in the mother****in' house Bounce, bounce, bounce, bounce Bounce, bounce, bounce Bounce, bounce, bounce, bounce Bounce, bounce, bounce Bounce, b-bounce, bounce, b-bounce Bounce, b-bounce, bounce Bounce, b-bounce, bounce, b-bounce Bounce Mo, m-m-mo bounce, blazin' up Back, bumpin', backyard bumpin', the block get loud Mo, m-m-m-mo bounce Backyard, backyard b-bumpin' Backyard bumpin', the block get loud When that shit goes down, the block get loud In your backyard bumpin' while we're blazin' out Make it bounce in the mother****in' house Mo bounce in the mother****in' house When that shit goes down, the block get loud In your backyard bumpin' while we're blazin' out Make it bounce in the mother****in' house Mo bounce in the mother****in' house Bounce, bounce, bounce, bounce Bounce, bounce, bounce Bounce, bounce, bounce, bounce Bounce, bounce, bounce Bounce, b-bounce, bounce, b-bounce Bounce, b-bounce, bounce B-bounce, bounce, b-bounce Bounce",1.0,1.0
421,"Iggz Look! Turn me up, break the knob right I get dressed like it's prom night I feed them lemons in the limelight They say I'm full, lost my appetite?! Keep on pushing like a dealer Keep on shooting, Reggie Miller Go and give 'em all the finger You gotta set the score right, call it Hans Zimmer My time wherever I gooo... I took a chance like I'm from Chicagooo... 100+ in that Murcielagooo... Bout to go ape, hey! Turn it to the congooo... Baby I got me Baby I got me And that's all I need Yeah that's all I need Baby I got me Only friend I need Playing on my team Is someone like.... Me, baby, no way Watch me while I do my thing Oh, baby, no way Are you ******* with the team? Outchea, pronto Hit 'em with the dose, that's a combo Running through ya block, no fumble Bout to kill 'em all, where the shovel? See I gotta go for mine Benja-jammin' - that money on my mind Jamaican club, I'm stayin' on the grind Dutty wine, don't step on this land mine! Ven aqui, andele You tryna take flight? Do what I say 100+ vogues on the highway Watch a new car dash, call me Kylie Baby I got me Baby I got me And that's all I need Yeah that's all I need Baby I got me Only friend I need Playing on my team Is someone like.... Me, baby, no way Watch me while I do my thing Oh, baby, no way Are you ******* with the team? Are you workin' with some cash here, cash here? 100,000 on the dash yeah, dash yeah All my ladies shake it fast yeah, fast yeah Now vogue on that ass, yup! Yeah we in here Are you workin' with some cash here, cash here? 100,000 on the dash yeah, dash yeah All my ladies shake it fast yeah, fast yeah Now vogue on that ass, yup! Yeah we in here Baby I got me Baby I got me And that's all I need Yeah that's all I need Baby I got me Only friend I need Playing on my team Is someone like.... Me, baby, no way Watch me while I do my thing Oh, baby, no way Are you ******* with the team? Team, team Team, team Are you *******' with the team? Are you *******' with the team? Are you *******' with the team?",1.0,1.0
424,作曲 : Daniel Reynolds/Daniel Sermon/Benjamin McKee/Daniel Platzman/Michael Daly 作词 : Daniel Reynolds/Daniel Sermon/Benjamin McKee/Daniel Platzman/Michael Daly There she goes in front of me Take my life and set me free again We'll make a memory out of it Holy road is at my back Don't look on take me back again We'll make a memory out of it We finally fall apart and we break each other's hearts If we wanna live young love we better start today It's gotta get easier oh easier somehow Cause I'm falling I'm falling Oh easier and easier somehow Oh I'm calling I'm calling And it isn't over unless it is over I don't wanna wait for that It's gotta get easier and easier somehow But not today Not today There she goes in front of me Take my life set me free again We'll make a memory out of it Holy road was at my back Don't look on take me back again We'll make a memory out of it We finally fall apart and we break each other's hearts If we wanna live young love we better start today It's gotta get easier oh easier somehow Cause I'm falling I'm falling Oh easier and easier somehow Oh I'm calling I'm calling And it isn't over unless it is over I don't wanna wait for that It's gotta get easier and easier So come with me You'll come with me ey So come with me You'll come with me ey Not today Not today Not today Not today It's gotta get easier and easier somehow Cause I'm falling I'm falling And easier and easier somehow Oh I'm calling and calling And it isn't over unless it is over I don't wanna wait for that It's gotta get easier and easier somehow It's gotta get easier and easier somehow Not today Not today Not today Not today Not today,1.0,1.0
427,"Falling too fast to prepare for this Tripping in the world could be dangerous Everybody circling is vulturous Negative, Nepotist Everybody waiting for the fall of man Everybody praying for the end of times Everybody hoping they could be the one I was born to run, I was born for this Whip, whip Run me like a race horse Hold me like a rip cord Break me down and build me up I wanna be the slip, slip Word upon your lip, lip Letter that you rip, rip Break me down and build me up Whatever it takes Cause I love the adrenaline in my veins I do whatever it takes Cause I love how it feels when I break the chains Whatever it takes Ya take me to the top, I'm ready for Whatever it takes Cause I love the adrenaline in my veins I do what it takes Always had a fear of being typical Looking at my body feeling miserable Always hanging on to the visual I wanna be invisible Looking at my years like a martyrdom Everybody needs to be a part of 'em Never be enough from the particle sum I was born to run, I was born for this Whip, whip Run me like a race horse Hold me like a rip cord Break me down and build me up I wanna be the slip, slip Word upon your lip, lip Letter that you rip, rip Break me down and build me up Whatever it takes Cause I love the adrenaline in my veins I do whatever it takes Cause I love how it feels when I break the chains Whatever it takes Ya take me to the top, I'm ready for Whatever it takes Cause I love the adrenaline in my veins I do what it takes Hypocritical, egotistical Don't wanna be the parenthetical Hypothetical, working onto something that I'm proud of Out of the box an epoxy to the world and the vision we've lost I'm an apostrophe I'm just a symbol to reminds you that there's more to see I'm just a product of the system, a catastrophe And yet a masterpiece, and yet I'm half diseased And when I am deceased At least I go down to the grave and I happily Leave the body of my soul to be a part of me I do what it takes Whatever it takes Cause I love the adrenaline in my veins I do whatever it takes Cause I love how it feels when I break the chains Whatever it takes Ya take me to the top, I'm ready for Whatever it takes Cause I love the adrenaline in my veins I do what it takes",1.0,1.0
428,"作曲 : Momomdou Jallow/Jonathan Mensah 作词 : Momomdou Jallow/Jonathan Mensah Did you see what Did you see what I done Did you see what I done Did you see what I done? Came in a black Benz, left in a white one I'm just a hoodlum I came with my bonsam when niggas wanna try some Did you see what I done? Came in a black Benz, left in a white one I'm just a hoodlum I came with the bonsam when niggas wanna try some Came looking like a ganja farmer Your daddy betta hide his daughter Shake her bonda just like I taught her Splashed her bonda with holy water Lickle spice for the winter season Your chicken needs a lickle season Did you see what he did? The black benz turn white and they can't believe it Make 'em repeat it Das some new shit They've never seen it You should feel it Meet and greet it I would be a genius if I didn't think with my penis Gyaldem thinking I'm awesome Mandem approach with caution True say we came with the bonsam But true say we came for the bunda Some round ting that I can put my paws on Did you see what I done? Came in a black Benz, left in a white one I'm just a hoodlum I came with my bonsam when niggas wanna try some Did you see what I done? Came in a black Benz, left in a white one I'm just a hoodlum I came with the bonsam when niggas wanna try some Came smelling like I've robbed a 9-bar Looking for the baddest diva Hol' up let me analyse her Batty looking like a hypnotiser Come let me try some Suttin' you can climb on Oh you're a shy one Who you tryna hide from? Baby jump in the black ride And put your friend in the white one I'm a benzo addict Pulled up in traffic Me and my friends switched cars and it looked like magic They never seen such a skinny man in a big puffer jacket That's unfamiliar, I came looking like a bodybuilder Out here's windy yana You're the one that I'm into yana Don't you wanna see the interior? Did you see what I done? Came in a black Benz, left in a white one I'm just a hoodlum I came with my bonsam when niggas wanna try some Did you see what I done? Came in a black Benz, left in a white one I'm just a hoodlum I came with the bonsam when niggas wanna try some Did you see what I done? Came in a black Benz, left in a white one I'm just a hoodlum I came with my bonsam when niggas wanna try some Did you see what I done? Came in a black Benz, left in a white one I'm just a hoodlum I came with the bonsam when niggas wanna try some",0.0,1.0
429,"For your eyes only, for your eyes only Hey *****s be dying on the daily It seems my dreams faded for far too long, the consequences deadly Can't visualize myself as nothing but a criminal Control the block, serving up rocks and stay subliminal Cause young *****s is hard headed, they letting off Full of adrenaline, ignorant to what death can cause Ain't no coming back, family dressed in black Plus it's hot now, the cops outside it's hard to flip a pack And my daughter gotta eat, her mama be stressing me Like I ain't the one who put them Jays on her feet Like I ain't out in the field like that I might be low for the moment but I will bounce back Despite the charges, back to the wall I fight regardless, Screaming ""***** the law"", my life is lawless That's what you call it Ain't got to be no psychic to see this is like the farthest thing from heaven This is hell and I don't mean that hyperbolic I try to find employment even if the swiper chargeless But these felonies be making life the hardest Resisting the temptation to run up and swipe a wallet Or run up on your yard, snatch your daughter bike and pawn it That's why I write this sonnet If the pressure get too much for me to take and I break Play this tape for my daughter and let her know my life is on it Let her know my life is on it Let her know my life is on For your eyes only For your eyes do you understand For your eyes do you understand me For your eyes do you understand For your eyes do you understand me For your eyes do you understand For your eyes do you understand me For your eyes do you understand For your eyes do you understand me You're probably grown now so this song'll hit you If you're hearing this unfortunately means that I'm no longer with you In the physical, not even sure if I believe in God But because you still alive He got me praying that the spiritual is real So I can be a part of you still, my pops was killed too So I know how part of you feels Maybe you hate me, maybe you miss me, maybe you spite me Life goes in cycles, maybe you'll date a ***** just like me I hope not, I'm tired of **** spots And fiends that smoke rocks, I've seen far too many *****s hopes rot I'm writing this because me and the devil had a dance Now I see death around the corner, apologizing in advance Don't know if I ever had a chance At a glance I'm a failure, addicted to pu*****ng paraphernalia But Daddy had dreams once, my eyes had a gleam once Innocence disappeared by the age of eight years My Pops shot up, drug related Mama addicted So Granny raised me in projects where thugs was hanging Blood was staining the concrete Older *****s I loved talked like they was above maintaining a time sheet That slow money, picked up the family business By the age of thirteen, six years later was handed sentence Round the same time is when you came in this world Me and your mama thinking, what the ***** we naming this girl? I told her Nina, the prettiest name that I could think of For the prettiest thing my eyes had ever seen I was nineteen, took me two felonies to see the trap, this crooked ass system set for me And now I fear it's too late for me to ever be the one that set examples that was never set for me I'm living fast, but not fast enough cause karma keeps on catching up to me And if my past becomes the death of me, I hope you understand For your eyes do you understand For your eyes do you understand me For your eyes do you understand For your eyes do you understand me For your eyes do you understand For your eyes do you understand me For your eyes do you understand For your eyes do you understand me It's several ways I could've went out, too many to count Was it the trigger happy crackers that the badges give clout Was it the young *****s, blasting frustrated cause the cash running out *****s don't know how to act in a drought See baby girl I realized, my definition of a real ***** was skewed My views misshaped by new mixtapes That confirmed the *****t I learned in the streets was true That real *****s don't speak when they beef with you They just pull up on your street, let the heat at you And if a real ***** hungry he gon' eat your food I was a fool, spent all my time ducking school, ducking cops Ducking rules, hugging blocks that don't love you I pray you find a ***** with goals and point of views Much broader than the corner, if not it's gon' corner you Into a box, where your son don't even know his pops And the cyclical nature of doing time continues My worst fear is one day that you come home from school and see your father face while hearing 'bout tragedy on news I got the strangest feeling your Daddy gonna lose his life soon And sadly if you're listening now it must mean it's true But maybe there's a chance that it's not And this album remains locked in a hard drive like valuable jewels And I can teach you this in person like I'm teaching you to tie your own shoes I love you and I hope to God I don't lose you For your eyes only For your eyes For your eyes only For your eyes For your eyes only For your eyes do you understand One day your daddy called me, told me he had a funny feeling What he'd been dealing with lately, he wasn't telling I tried to pick his brains, still he wasn't revealing But I could feel the sense of panic in his voice and it was chilling He said ""Jermaine, I knew you since we was children I never asked for nothing When times was hard I never had discussions with you begging you to help me I dealt with the repercussions of my actions I know you tried to steer me 'way from that *****t But that *****t was in my blood, you know my life I know your Momma *****, send my love In case I never get a chance to speak again I won't forget the weekends spent sleeping at your crib That's the way I wished my family lived But my granny crib was in the 'jects I had to interject like, ""***** what you talking 'bout? ***** is you getting at?"" He said ""Listen, I got no time to dive into descriptions But I've been having premonitions, just call it visions from the other side I got a feeling I won't see tomorrow, like the time I'm living on is borrowed With that said the only thing I'm proud to say I was a father Write my story down and if I pass go play it for my daughter when she ready And so I'm leaving you this record for your eyes only, don't you ever scratch or disrespect it This perspective is a real one, another lost Ville son I dedicate these words to you and all the other children Affected by the mass incarceration in this nation That sent your pops to prison when he needed education Sometimes I think this segregation would've done us better Although I know that means I would never be brought into this world 'cuz my daddy was so thrilled when he found him a white girl to take back to Jonesborough with'lil Zach and Cole World barely one years old, now it's thirty years later making sure the story's told Girl your daddy was a real *****, not 'cos he was cold Not because he was the first to get some ***** twelve years old Not because he used to come through in the Caddy on some vogues Not because he went from bagging up them grams to serving O's Nah your daddy was a real *****, not 'cos he was hard Not because he lived a life of crime and sat behind some bars Not because he screamed ***** the law, although that was true Your daddy was a real ***** 'cuz he loved you"" For your eyes only",0.0,0.0
