id,lyrics,arousal_bin,valence_bin
624,"Fast Lyrics Fast That's the kind of car you wanna drive when you're sixteen Fast That's the kind of boys that you want on your home team Fast Yeah, you think you're gonna catch your big dreams just like that Fast And here you are, looking back Sixty seconds now feels more like thirty Tick-tock, won't stop, around it goes Sand through the glass sure falls in a hurry All you keep trying to do is slow it down, soak it in You're trying to make the good times last as long as you can But you can't, man It just goes too fast Fast That's what your parents said when we were falling in love It's too fast There ain't no way the two of us were ever going to last But we did, and here we are, and our only problem is Sixty seconds now feels more like thirty Tick-tock, won't stop, around it goes Sand through the glass sure falls in a hurry All you keep trying to do is slow it down, soak it in You're trying to make the good times last as long as you can But you can't, man It just goes too fast Looking at you looking out the window right now Those eyes, that dress, that smile, that laugh If I could hit pause, I would somehow But it don't work like that Sixty seconds now feels more like thirty Tick-tock, won't stop, around it goes Sand through the glass sure falls in a hurry All you keep trying to do is slow it down, soak it in You're trying to make the good times last as long as you can But you can't, man It goes too fast It just goes too fast Way too fastYou might also like3Embed",1.0,1.0
629,"Gold medals, them my role models Rollin' old models, lowered old schools Flowin' cold and goin' gold follows Flower bearin', call it petals to the floor Power sharin', call it devils to the door Power, power, 'til ain't no devils anymore Flower, flowers, they be droppin' at the feet of my son Move a thousand miles per hour down the street of my slum And who do I meet, to the beat of my drum It was little Susie Uzi, she sold crack and was a killer All bitch dope tip, wasn't trappin' with no niggas Had a long money, minor do that action for them figures Her influence fully automatic, crackin' off the Richter, yeah Walked up to my ride, asked me could she get inside She pointed at her pistol so I properly replied Told me, out here in the streets, she ain't have no competition And with me up on them beats, then we shared the same description With a blunt between her lips, she said, ""Now here's my proposition: You just write a bunch of raps for me and I'ma go and spit 'em Then we take 'em to the radio, the DJ better spin 'em Then we take 'em to the record store and sell a couple million"" I already got the money, already got the bitches I see these other niggas, I'ma do it how they did it From a trapper to a rapper, trapper to a rapper Trapper to a rapper, now nigga, make it happen Tell me call up Soundtrakk, have him send a couple beats Not that ""Superstar"" shit, she wanted somethin' for the streets Said it might take like a month, she said it better take a week Gave my arm a little punch and then she pointed at her heat Said, ""I saw that thing the first time, you don't gotta do it twice But I need a lil' more info on exactly what I write Some details 'bout a female, 'bout your life and what you like"" She said, ""My life is like a bitch, and I'm just like my life"" Then pow-pow-pow-pow-pow, yeah them niggas started bussin' Like that boycott was over and that we had overcome it She said, ""Nigga hit the gas,"" went from zero to a hunnid Now we runnin' from some killers, I was so sick to my stomach She was hangin' out the window with that thumper she was dumpin' Had a look upon her face that made me think that she was cummin' We was swervin', jumped the curb And ditched the whip and started runnin' Tried to jump over a wall, but it was a little tall So we ducked behind a bush and that's how we got overlooked I was shook and breathin' hard And she was sittin' there smokin' kush Then we both started to glow, we looked around like ""What is this?"" And then we looked up and a light came down And pulled us to a ship, like, ""What the ****?"" I already got the money, already got the bitches I see these other niggas, I'ma do it how they did it From a trapper to a rapper, trapper to a rapper Trapper to a rapper, now nigga, make it happen Well now this the shit I'm talkin' 'bout, the shit that I've been on Yeah lightyears outer space, but still a bitch feel right at home Now where the bitches? Get them intergalactic asses to clappin' Break down some of that candy and roll it up in a wrapper for a rapper Nah I could never go back to trappin' And who needs Atlanta when you're on Saturn gettin' a lapdance With a lit match in your left hand, and your right hand is a gas can And at any given moment, I could burn this shit up Why you standin' there just lookin', nigga? Turn that shit up Hop in some of this alien pussy, let me know how it work I'm just sayin', I'm gon' be there and I ain't in no rush Nah, nigga, nah nigga I ain't in no rush Ayy I thought you couldn't rap, when'd you learn how to do that? Then what you need me for if you already know how to flow? Ayy **** that, we gotta go, wouldn't even be in this ho If you told me from the jump we wouldn't be on this UFO But I think that I can fly us, stole a key so I can try it Never thought that I would ever be a flyin' saucer pilot But first thing's gon' be first, when we get back to that earth I'ma go back to them raps and you can go back to that work, nigga I already got the money, already got the bitches I see these other niggas, I'ma do it how they did it From a trapper to a rapper, trapper to a rapper Trapper to a rapper, now nigga, make it happen Ayy look, the basic thing is, you can do whatever you wanna do. Like I ain't 'bout to pass up on all this shit, you see this? Like we time jumpin' and shit. You wanna go back and do what, just rap? You can rap up here! Yeah nigga, just rap. No you can't, nigga, this is space. We can't, **** that, we goin' home. DROGAS!",1.0,1.0
632,"I wrote this song as a message for help On behalf of anybody findin' their-self I wrote this letter to numb your pain 'Cause everyday I wake up I'm feeling the same I got issues just like you got issues I been hurt I seen scar tissue If I show you, would you run away? Do I gotta hide 'em for you to wanna stay Do I even need you, should I leave you Do I gotta be you, just to please you Do I say I'm all good, when I bleed you Through my, heart, quit tearing mine apart I shout, I swear, I get angry, I get scared I fall, I break, I mess up, I make mistakes But if you can't take me at my worst You don't deserve me at my best Got to keep it going, got to keep my head up, uh Got to keep it going, got to keep my head up, uh Got to keep it going, got to keep my head up cause life is about, aight check this out Life is about making mistakes It's also about tryna be great Do not let failure scare you away I know you fed up, you fall, get up It's all in us, I can speak about 'cause I did it Ladies and gentlemen here's the exhibit It's my life look a little closer you could see the highlight Gold ain't always golden but I told 'em Look at all the years I've been waiting for a moment Shed a lot of tears just to smile in the morning Tell me could you love me, tell me could you love me Tell me could you love me if I told you why I shout, I swear, I get angry, I get scared I fall, I break, I mess up, I make mistakes But if you can't take me at my worst You don't deserve me at my best This song's for anybody, yeah Who feels like I did Never the cool kid This song's for anybody Who fought their way through Always remain true This song's for anybody The one's who trying to get it The one's who dreaming and live it This song's for anybody This song, this song, this song, this song I shout, I swear, I get angry, I get scared I fall, I break, I mess up, I make mistakes But if you can't take me at my worst You don't deserve me at my best Got to keep it going, got to keep my head up, uh Got to keep it going, got to keep my head up, uh Got to keep it going, got to keep my head up cause life is about Turn my vocals up, alright",1.0,1.0
634,Nawfside cooling shorty yeah that's where I stay Heard you was a lame boy get up out my face And my ex keep calling swear that she be in the way And I need a thick Redbone shorty where I lay Bad bihh in L.A. tell me that she'll make the trip Shorty bad as hell yeah with them Kylie Jenner lips Uber every f**king where pre-rolls in my VIP Canada jawn yeah I think that bitch from the 6 Shorty wanna kiss me but I know she sucking dick Shorty wanna kiss me but I know she sucking dick Look Uber everywhere pre-rolls in the VIP Yeah Uber everywhere pre-rolls in my VIP Aye Skrr skrr Yeah I wanna get the 'Rari But I know it takes some time Skrr skrr Pre-roll shorty light it up you know you fine Lil 5 with my 5 and I'm rolling up the gat And I need my leg room Bapestas first class East Atlanta jawn Cookout on Moreland Ave Skrr skrr Say she bout that ass shit but I think that I'mma pass Shorty wanna f**k me but I know I got some top Shorty wanna f**k me but I just got some top Skrr skrr I can't f**k with ops never stop pull up in that juice box Uber f**king everywhere I can't f**k with ops never stop pull up in that juice box Uber f**king everywhere Uber everywhere pre-rolls in my VIP Skrr skrr Uber everywhere pre-rolls in my VIP And I think that bitch from Canada I think she from the 6 Uber everywhere pre-rolls in the VIP Hey hey hey hey Skrr skrr Hey hey hey Skrr skrr Hey hey hey Skrr skrr Hey hey hey Uber everywhere pre-rolls in my VIP Uber everywhere pre-rolls in my VIP Skrr skrr And I think that bitch from Canada I think she from the 6 Uber everywhere pre-rolls in the VIP,0.0,0.0
639,"Barbie Yeah They thought that you was a shy girl Until I made you my girl Girl you pushed me like a big button 'Til I cuffed you like you did somethin' You ain't gotta wait for it You ain't gotta wait for me to give you my love You ain't gotta wait for it Things are gettin' sticky, girl I think that I'm stuck I'll admit I'm wrong when I know that you gon' come for me When you gon' come for me, yeah Never gonna not not hit that, your lovin' is just too deep When you gon' come to me, yeah And every time you hit my phone, and say you need company, oh I'ma run up on you I'ma run up on you I'ma run up on you I'ma run up on you I'ma run up on you I'ma run up on you I'ma run up on you I'ma run up on you I'ma run up on you I'ma run up on you Girl you used to bein' quiet 'Til I brought that loud You say your dollars is amountin' And your mama your accountant You watch your figures, you a big deal Got your fresh prince and a big wheel Polar mink coat, that's a big kill Put you on a phone like a windshield I'll admit I'm wrong when I know that you gon' come for me When you gon' come for me, yeah Never gonna not not hit that, your lovin' is drugs to me When you gon' come to me, yeah And every time you hit my phone, and say you need company, oh I'ma run up on you I'ma run up on you I'ma run up on you I'ma run up on you I'ma run up on you I'ma run up on you I'ma run up on you I'ma run up on you I'ma run up on you I'ma run up on you Major keys, I'm the boss Dont Griselda go off Left from the loft and Went to bergdorf Most of these dudes is really quite soft 45 special this is my cloth Bout to drop a album this is my fourth I don’t put sugar in my spaghetti sauce Drop a freestyle and get these hoes parched Fire burn the obea man church Pretty girls, when my girls get right Cause it's another day, let ya light shine bright Ain't none of them in your lane True mi have di game pon lock, dem wah code Just link wit some hot gyal out ah road True mi have di waist small, pretty, bus whine Rolex nah deh pon uno dutty gyal time? Yo, I told  em pull up on me Faster than Danica Thats on the low i'm  Tryna  blow him like harmonicas He call me queen he know ""Nicki"" is the Moniker He want a mix between Hillary and Monica I switch it up, I switch It up, rip the beat then i I stitch it up Travel then I bounce I ball  -Sinead, Sir Barbie a link up Major Lazer I'ma run up on you I'ma run up on you I'ma run up on you I'ma run up on you I'ma run up on you I'ma run up on you I'ma run up on you I'ma run up on you",1.0,1.0
643,"Maluma baby A penas sale el soy y tú te vas corriendo Se que pensarás que esto me está doliendo Yo no estoy pensando en lo que estas haciendo Si somos amigos y así nos queremos Si conmigo te quedas O con otro tu te vas No me importa un carajo Porque sé que volverás Si conmigo te quedas O con otro tu te vas No me importa un carajo Porque sé que volverás Y si con otro pasas el rato Vamos a ser feliz, vamos a ser feliz Felices los 4 Te agrandamos el cuarto Y si con otro pasas el rato Vamos a ser feliz, vamos a ser feliz Felices los 4 Yo te acepto el trato Y lo hacemos otro rato Y lo hacemos otro rato Y lo hacemos otro rato Y lo hacemos otro rato Y lo hacemos otro rato Lo nuestro no depende de un pacto Disfruta y solo siente el impacto El boom boom que te quema, ese cuerpo de sirena Tranquila que no creo en contratos Y siempre que se va, regresa a mi Y felices los 4 No importa el que dirán, nos gusta así Y siempre que se va, regresa a mi Y felices los 4 No importa el que dirán, somos tal para cual Y si con otro pasas el rato Vamos a ser feliz, vamos a ser feliz Felices los 4 Te agrandamos el cuarto Y si con otro pasas el rato Vamos a ser feliz, vamos a ser feliz Felices los 4 Yo te acepto el trato Y lo hacemos otro rato Y lo hacemos otro rato Y lo hacemos otro rato Y lo hacemos otro rato Si conmigo te quedas O con otro tu te vas No me importa un carajo Porque se que volverás Si conmigo te quedas O con otro tu te vas No me importa un carajo Porque se que volverás Y si con otro pasas el rato Vamos a ser feliz, vamos a ser feliz Felices los 4 Te agrandamos el cuarto Y si con otro pasas el rato Vamos a ser feliz, vamos a ser feliz Felices los 4 Yo te acepto el trato Y lo hacemos otro rato Y lo hacemos otro rato Y lo hacemos otro rato Y lo hacemos otro rato Y siempre que se va, regresa a mi Maluma baby No importa el que dirán, nos gusta así Kevin ADG, Chan El Genio Y siempre que se va, regresa a mi El código secreto baby No importa el que dirán, somos tal para cual Así lo quiso el destino mami Muaaa",1.0,1.0
644,"You & Me Lyrics Girl you party all the time Don't let me stay on your mind Adderall and cheap wine Just to stay awake in conversation We were always so damn insecure So how could we ever know for sure And disregard the way I know we feel That would make this city way too real If we bump into each other On a crowded street It’s not us no more It’s just you and me We’re just strangers in passing casually It’s not us no more It’s just you and me The shirt on my back with the rips Gems in my golden necklace You didn't give me none of this There's nothing for me to miss We were too young on the day we met How could we say we would not forget And in the shadows there's a place for us Somewhere hidden they can't find our love Don't let 'em know If we bump into each other On a crowded street It’s not us no more It’s just you and me We’re just strangers in passing casually It’s not us no more It’s just you and me Eazy, and these days it's just you and me This shit is dead and gone, it's not what it used to be Someone give a eulogy Know I'm hard headed and I might of acted foolishly But you the one to hold us down usually We was in a limbo But of all people you ain't have to fuck with him though That was my homie I had gave y'all the intro Some things fall apart and some get thrown out the window Remember when we first met we might've been too young But we was from The Bay so we both was going too dumb I used to be the one for you now you got a new one So till the next lifetime, maybe we can do some'n Eazy You might also like If we bump into each other On a crowded street It’s not us no more It’s just you and me We’re just strangers in passing casually It’s not us no more It’s just you and me If we bump into each other On a crowded street It's not us no more23Embed",1.0,1.0
647,"Usually a drink will do the trick Take the edge off quick Sitting in the dark with a shared cigarette Seeing eye-to-eye, and heart-to-heart But maybe I'm just getting old Used to work but now it don't A long gone drive You know the kind where you take a turn And you don't know why But it clears your mind, a surefire cure I need something stronger That'll last a little longer I could use a love song That takes me back, just like that when it comes on To a time when I wouldn't roll my eyes At a guy and a girl Who make it work in a world That for me so far just seems to go so wrong Yeah I could use, I could use a love song I wish I didn't know so much I peeked behind the curtain Now that magic rush Feels like a trick that isn't working But I haven't lost all hope yet Yeah it's hurting but it ain't dead I could use a love song That takes me back, just like that when it comes on To a time when I wouldn't roll my eyes At a guy and a girl Who make it work in a world That for me so far just seems to go so wrong Yeah I could use, I could use a love song Give me a sign or a rhyme or a reason Just something that I can believe in I could use a love song That takes me back, just like that when it comes on To a time when I wouldn't roll my eyes At a guy and a girl Who make it work in a world That for me so far just seems to go so wrong Yeah I could use Yeah I could use, I could use a love song",1.0,1.0
648,"I've cussed on a Sunday I've cheated and I've lied I've fallen down from grace A few too many times But I find holy redemption When I put this car in drive Roll the windows down and turn up the dial Can I get a hallelujah Can I get an amen Feels like the Holy Ghost running through ya When I play the highway FM I find my soul revival Singing every single verse Yeah I guess that's my church When Hank bring the sermon And Cash leads the choir It gets my cold cold heart burning Hotter than a ring of fire When this wonderful world gets heavy And I need to find my escape I just keep the wheels rolling, radio scrolling Until my sins wash away Can I get a hallelujah Can I get an amen Feels like the Holy Ghost running through ya When I play the highway FM I find my soul revival Singing every single verse Yeah I guess that's my church Can I get a hallelujah Can I get an amen Feels like the Holy Ghost running through ya When I play the highway FM I find my soul revival Singing every single verse Yeah I guess that's my church Can I get a hallelujah Can I get an amen Feels like the Holy Ghost running through ya When I play the highway FM I find my soul revival Singing every single verse Yeah I guess that's my church Yeah I guess that's my church Yeah I guess that's my church",1.0,1.0
656,"作曲 : Adam Levine/Jacob Kasher Hindlin/John Ryan/Justin Tranter/Phil Shaouy 作词 : Adam Levine/Jacob Kasher Hindlin/John Ryan/Justin Tranter/Phil Shaouy Cold enough to chill my bones It feels like I don't know you anymore I don't understand why you're so cold to me With every breath you breathe I see there's something going on I don't understand why you're so cold Are we taking time or a time out? I can't take the in-between Asking me for space here in my house You know how to **** with me Acting like we're not together After everything that we've been through Sleeping up under the covers How am I so far away from you? Distant, when we're kissing Feel so different Baby tell me how did you get so Cold enough to chill my bones It feels like I don't know you anymore I don't understand why you're so cold to me With every breath you breathe I see there's something going on I don't understand why you're so cold, yeah Woah, yeah Woah, yeah I don't understand why you're so cold What you holdin' on, holdin' on for? If you wanna leave just leave Why you wanna bite your tongue for? The silence is killing me Acting like we're not together If you don't want this, then what's the use? Sleeping up under the covers How am I so far away from you? Distant, when we're kissing Feel so different Baby tell me how did you get so Cold enough to chill my bones It feels like I don't know you anymore I don't understand why you're so cold to me With every breath you breathe I see there's something going on I don't understand why you're so cold, yeah Woah, yeah Woah, yeah I don't understand why you're so cold, yeah So **** this cold world Woah, yeah So **** this cold world Woah, yeah So **** this cold world I don't understand why you're so cold Never thought that you were like this I took the tag off and made you priceless I just spent half a mill' on a chandelier Now you tryna cut me off like a light switch, yeah Tryna stay, and I leave Saying that you need some time to breath Thinking that I'm sleeping on the four letter word But the four letter word don't sleep We goin' two separate ways You ain't been actin' the same You gotta go, but where your heart used to be You gold dig every day I switched the four door to the two door 'Cause I can't let my driver hear what you say Girl I tried to give you space Baby tell me how did you get so Cold enough to chill my bones It feels like I don't know you anymore I don't understand why you're so cold to me With every breath you breathe I see there's something going on I don't understand why you're so cold So **** this cold world Woah, yeah So **** this cold world Woah, yeah So **** this cold world I don't understand why you're so cold, yeah So **** this cold world Woah, yeah So **** this cold world Woah, yeah So **** this cold world I don't understand why you're so cold",0.0,0.0
659,作曲 : Adam Levine/James Valentine 作词 : Adam Levine/James Valentine Beauty queen of only eighteen She had some trouble with herself He was always there to help her She always belonged to someone else I drove for miles and miles And wound up at your door I've had you so many times But somehow I want more I don't mind spending everyday Out on your corner in the pouring rain Look for the girl with the broken smile Ask her if she wants to stay awhile And she will be loved And she will be loved Tap on my window knock on my door I want to make you feel beautiful I know I tend to get so insecure It doesn't matter anymore It's not always rainbows and butterflies It's compromise that moves us along My heart is full and my door's always open You come anytime you want I don't mind spending everyday Out on your corner in the pouring rain Look for the girl with the broken smile Ask her if she wants to stay awhile And she will be loved And she will be loved And she will be loved And she will be loved I know where you hide alone in your car Know all of the things that make you who you are I know that goodbye means nothing at all Comes back and begs me to catch her everytime she falls Tap on my window knock on my door I want to make you feel beautiful I don't mind spending everyday Out on your corner in the pouring rain Look for the girl with the broken smile Ask her if she wants to stay awhile And she will be loved And she will be loved And she will be loved And she will be loved I don't mind spending everyday Out on your corner in the pouring rain I tried so hard to say good-bye,0.0,0.0
670,"Winter days, turn to grey, put the headlights on Snow and rain, wiped away, I can't keep my eyes on the road When I'm driving home, I got tears, running down Burning in my eyes and you and I Heated by the flicker of a lighter Oh, and I let it go But I just got here I know it's been a while darling, dear There's been a change in the time of year When the frost bites the snow And Christmas comes around For the down and outs And broken lay-abouts What will they do now? When Christmas comes around We were so in love Till I messed it up But who will love me now When Christmas comes around Family asking me, why I let you go Telling me, it’s a mistake I'm telling them that I know But I can't call you Your inner space, better place Loving on a new man I don't blame you at all You did all that you can, I know But I just got here I know it's been a while darling, dear There's been a change in the time of year When the frost bites the snow And Christmas comes around For the down and outs And broken lay-abouts What will they do now? When Christmas comes around We were so in love Till I messed it up But who will love me now When Christmas comes around And, I'm sick of all the songs The Christmas sing-alongs The merry and the cheer Cuz I don't feel like that this year All the bells are all in sync And my soul is on the brink So I'll have myself a drink, and sing Christmas comes around For the down and outs And broken lay-abouts What will they do now? When Christmas comes around We were so in love Till I messed it up But who will love me now When Christmas comes around Who will love me now When Christmas comes around",0.0,0.0
